{
  "$schema": "https://json-schema.org/draft/2020-12/schema",
  "$id": "https://helioverse.contracts/event.schema.json",
  "title": "Helioverse Event v1 (spec §5)",
  "description": "One tracked solar event: CME, flare, shock, SEP, storm, or filament eruption. IDs are DONKI-style for clean joins to NASA/CCMC ground truth. Kinematics are a VERSIONED ARRAY (CME analyses get revised; all versions are kept for the eval loop's leakage discipline, spec §8.5). Predictions carry inputs_as_of so the hindcast can prove what was knowable at prediction time. Units in field names as in snapshot.schema.json; heliographic Stonyhurst lon/lat in degrees (lon 0 = Sun-Earth line, +west).",
  "type": "object",
  "additionalProperties": false,
  "required": ["schema_version", "id", "uuid", "type", "detected_at", "kinematics", "earth_bound_score", "links", "predictions", "outcome", "provenance"],
  "properties": {
    "schema_version": { "type": "string", "pattern": "^1\\.\\d+\\.\\d+$" },
    "id": { "$ref": "#/$defs/event_id" },
    "uuid": { "type": "string", "pattern": "^[0-9a-f]{8}-[0-9a-f]{4}-[0-9a-f]{4}-[0-9a-f]{4}-[0-9a-f]{12}$", "description": "Internal stable alias (spec §5 ID strategy)." },
    "type": { "type": "string", "enum": ["CME", "FLR", "IPS", "SEP", "GST", "FILAMENT"] },
    "detected_at": { "$ref": "#/$defs/iso_utc" },
    "peak_at": { "oneOf": [{ "$ref": "#/$defs/iso_utc" }, { "type": "null" }] },
    "liftoff_at": { "oneOf": [{ "$ref": "#/$defs/iso_utc" }, { "type": "null" }] },
    "source_region": {
      "oneOf": [
        {
          "type": "object",
          "additionalProperties": false,
          "required": ["lon_deg", "lat_deg"],
          "properties": {
            "ar_number": { "oneOf": [{ "type": "integer", "minimum": 1 }, { "type": "null" }] },
            "lon_deg": { "type": "number", "minimum": -180, "maximum": 180 },
            "lat_deg": { "type": "number", "minimum": -90, "maximum": 90 },
            "instrument": { "oneOf": [{ "type": "string", "maxLength": 64 }, { "type": "null" }] }
          }
        },
        { "type": "null" }
      ]
    },
    "kinematics": {
      "type": "array",
      "description": "All analysis versions, oldest first. Exactly one entry may have is_most_accurate=true. Empty for non-CME events.",
      "items": { "$ref": "#/$defs/kinematics_version" }
    },
    "flare": {
      "oneOf": [
        {
          "type": "object",
          "additionalProperties": false,
          "required": ["class"],
          "properties": {
            "class": { "type": "string", "pattern": "^[ABCMX]\\d{1,2}(\\.\\d)?$" },
            "xray_peak_wm2": { "oneOf": [{ "type": "number", "minimum": 0 }, { "type": "null" }] }
          }
        },
        { "type": "null" }
      ]
    },
    "thumbnail": {
      "oneOf": [
        {
          "type": "object",
          "additionalProperties": false,
          "required": ["r2_key", "captured_at", "wavelength"],
          "properties": {
            "r2_key": { "type": "string", "pattern": "^v1/thumbs/" },
            "captured_at": { "$ref": "#/$defs/iso_utc" },
            "wavelength": { "type": "string", "maxLength": 24, "description": "e.g. LASCO-C2, 0304, 0193" },
            "crop": {
              "type": "object",
              "additionalProperties": false,
              "required": ["x", "y", "w", "h"],
              "properties": {
                "x": { "type": "number" }, "y": { "type": "number" },
                "w": { "type": "number", "exclusiveMinimum": 0 }, "h": { "type": "number", "exclusiveMinimum": 0 }
              }
            }
          }
        },
        { "type": "null" }
      ]
    },
    "earth_bound_score": { "type": "number", "minimum": 0, "maximum": 1, "description": "Geometric x kinematic confidence (spec §6.3). Calibrated post-v1 (isotonic/Platt, §8.5); v1 ships the geometric heuristic." },
    "links": {
      "type": "array",
      "items": {
        "type": "object",
        "additionalProperties": false,
        "required": ["id", "rel"],
        "properties": {
          "id": { "$ref": "#/$defs/event_id" },
          "rel": { "type": "string", "enum": ["caused_by", "causes", "merged_into", "merged_from", "associated"], "description": "Edge from THIS event's perspective. CME caused_by FLR; IPS caused_by CME; GST caused_by IPS/CME; compound events use merged_from/merged_into (spec §6.2)." }
        }
      }
    },
    "predictions": { "type": "array", "items": { "$ref": "#/$defs/prediction" } },
    "outcome": { "oneOf": [{ "$ref": "#/$defs/outcome" }, { "type": "null" }] },
    "provenance": {
      "type": "object",
      "additionalProperties": false,
      "required": ["catalog", "first_seen_at", "as_of"],
      "properties": {
        "catalog": { "type": "string", "enum": ["DONKI", "SWPC", "HELIOVERSE"] },
        "donki_activity_id": { "oneOf": [{ "type": "string", "maxLength": 80 }, { "type": "null" }] },
        "first_seen_at": { "$ref": "#/$defs/iso_utc", "description": "When OUR ingest first saw it — detection-latency metric input (spec §8.4-F)." },
        "as_of": { "$ref": "#/$defs/iso_utc", "description": "Last time this object was updated from upstream." }
      }
    }
  },
  "$defs": {
    "iso_utc": { "type": "string", "pattern": "^\\d{4}-\\d{2}-\\d{2}T\\d{2}:\\d{2}(:\\d{2})?Z$" },
    "event_id": { "type": "string", "pattern": "^\\d{4}-\\d{2}-\\d{2}T\\d{2}:\\d{2}Z-(CME|FLR|IPS|SEP|GST|FILAMENT)-\\d{3}$" },
    "kinematics_version": {
      "type": "object",
      "additionalProperties": false,
      "required": ["version", "measured_at", "speed_kms", "half_angle_deg", "direction", "is_halo", "is_most_accurate"],
      "properties": {
        "version": { "type": "integer", "minimum": 1 },
        "measured_at": { "$ref": "#/$defs/iso_utc", "description": "When this analysis was published — the as-of gate for leakage-safe hindcasts." },
        "speed_kms": { "type": "number", "minimum": 50, "maximum": 4000 },
        "half_angle_deg": { "type": "number", "minimum": 1, "maximum": 90 },
        "direction": {
          "type": "object",
          "additionalProperties": false,
          "required": ["lon_deg", "lat_deg"],
          "properties": {
            "lon_deg": { "type": "number", "minimum": -180, "maximum": 180 },
            "lat_deg": { "type": "number", "minimum": -90, "maximum": 90 }
          }
        },
        "cme_type": { "oneOf": [{ "type": "string", "enum": ["S", "C", "O", "R", "ER"] }, { "type": "null" }], "description": "SWPC speed class (spec §5)." },
        "measurement_technique": { "oneOf": [{ "type": "string", "maxLength": 32 }, { "type": "null" }], "description": "DONKI CMEAnalysis type, e.g. LE, SH, SWPC_CAT." },
        "is_halo": { "type": "boolean" },
        "is_most_accurate": { "type": "boolean" }
      }
    },
    "prediction": {
      "type": "object",
      "additionalProperties": false,
      "required": ["predicted_at", "model", "inputs_as_of", "hit_probability"],
      "properties": {
        "predicted_at": { "$ref": "#/$defs/iso_utc" },
        "model": { "type": "string", "maxLength": 64, "description": "e.g. dbm-v1.0, enlil-wsa-2.2, scoreboard:NOAA. Versioned so the eval segments by model (spec §8.4-E)." },
        "inputs_as_of": { "$ref": "#/$defs/iso_utc", "description": "Latest input timestamp used. MUST be <= predicted_at. The leakage gate (spec §8.5): hindcasts may only use kinematics versions with measured_at <= this." },
        "hit_probability": { "type": "number", "minimum": 0, "maximum": 1 },
        "arrival": {
          "oneOf": [
            {
              "type": "object",
              "additionalProperties": false,
              "required": ["eta", "window_start", "window_end", "window_ci"],
              "properties": {
                "eta": { "$ref": "#/$defs/iso_utc" },
                "window_start": { "$ref": "#/$defs/iso_utc" },
                "window_end": { "$ref": "#/$defs/iso_utc" },
                "window_ci": { "type": "number", "exclusiveMinimum": 0, "exclusiveMaximum": 1, "description": "Stated coverage of [window_start, window_end], e.g. 0.8. PIT/calibration metric checks this is honest (spec §8.4-A)." }
              }
            },
            { "type": "null" }
          ]
        },
        "arrival_speed_kms": { "oneOf": [{ "$ref": "#/$defs/value_sigma" }, { "type": "null" }] },
        "peak_kp": { "oneOf": [{ "$ref": "#/$defs/value_sigma" }, { "type": "null" }] },
        "min_dst_nt": { "oneOf": [{ "$ref": "#/$defs/value_sigma" }, { "type": "null" }] },
        "params": { "type": "object", "description": "Free-form theta used (gamma, ambient wind, wake term...). Stored so refits are reproducible (spec §8.5)." }
      }
    },
    "outcome": {
      "type": "object",
      "additionalProperties": false,
      "required": ["resolved_at", "hit", "sources"],
      "properties": {
        "resolved_at": { "$ref": "#/$defs/iso_utc" },
        "hit": { "type": "boolean" },
        "shock_arrival_at": { "oneOf": [{ "$ref": "#/$defs/iso_utc" }, { "type": "null" }] },
        "arrival_speed_kms": { "oneOf": [{ "type": "number", "minimum": 0 }, { "type": "null" }] },
        "peak_kp": { "oneOf": [{ "type": "number", "minimum": 0, "maximum": 9 }, { "type": "null" }] },
        "min_dst_nt": { "oneOf": [{ "type": "number" }, { "type": "null" }] },
        "min_dst_at": { "oneOf": [{ "$ref": "#/$defs/iso_utc" }, { "type": "null" }] },
        "sources": { "type": "array", "minItems": 1, "items": { "type": "string", "maxLength": 80 }, "description": "Ground-truth provenance, e.g. DONKI:IPS-..., kyoto-dst, swpc-kp (spec §8.3)." },
        "notes": { "oneOf": [{ "type": "string", "maxLength": 500 }, { "type": "null" }] }
      }
    },
    "value_sigma": {
      "type": "object",
      "additionalProperties": false,
      "required": ["value", "sigma"],
      "properties": {
        "value": { "type": "number" },
        "sigma": { "type": "number", "minimum": 0 }
      }
    }
  }
}
