{
  "schema_version": "1.0.0",
  "id": "2026-05-20T11:12Z-CME-002",
  "uuid": "c41d8e72-55ab-4f09-9d3c-7b8e1a2f6c03",
  "type": "CME",
  "detected_at": "2026-05-20T11:36Z",
  "peak_at": null,
  "liftoff_at": "2026-05-20T11:12Z",
  "source_region": {
    "ar_number": 14102,
    "lon_deg": 8.0,
    "lat_deg": -14.0,
    "instrument": "LASCO/C3"
  },
  "kinematics": [
    {
      "version": 1,
      "measured_at": "2026-05-20T14:50Z",
      "speed_kms": 880.0,
      "half_angle_deg": 38.0,
      "direction": { "lon_deg": 6.0, "lat_deg": -12.0 },
      "cme_type": "C",
      "measurement_technique": "LE",
      "is_halo": false,
      "is_most_accurate": true
    }
  ],
  "flare": { "class": "M5.4", "xray_peak_wm2": 5.4e-5 },
  "thumbnail": {
    "r2_key": "v1/thumbs/2026-05-20T1112Z-CME-002.jpg",
    "captured_at": "2026-05-20T11:12Z",
    "wavelength": "LASCO-C3",
    "crop": { "x": 480, "y": 420, "w": 256, "h": 256 }
  },
  "earth_bound_score": 0.62,
  "links": [
    { "id": "2026-05-23T05:12Z-IPS-001", "rel": "causes" },
    { "id": "2026-05-23T08:00Z-GST-001", "rel": "causes" }
  ],
  "predictions": [
    {
      "predicted_at": "2026-05-20T15:10Z",
      "model": "dbm-v1.0",
      "inputs_as_of": "2026-05-20T14:50Z",
      "hit_probability": 0.62,
      "arrival": {
        "eta": "2026-05-23T02:00Z",
        "window_start": "2026-05-22T17:00Z",
        "window_end": "2026-05-23T11:00Z",
        "window_ci": 0.8
      },
      "arrival_speed_kms": { "value": 520.0, "sigma": 70.0 },
      "peak_kp": { "value": 5.3, "sigma": 1.0 },
      "min_dst_nt": { "value": -60.0, "sigma": 30.0 },
      "params": { "gamma_per_km": 5e-8, "ambient_wind_kms": 380.0, "target_r_km": 148800000.0 }
    }
  ],
  "outcome": {
    "resolved_at": "2026-05-24T06:00Z",
    "hit": true,
    "shock_arrival_at": "2026-05-23T05:12Z",
    "arrival_speed_kms": 545.0,
    "peak_kp": 5.67,
    "min_dst_nt": -78.0,
    "min_dst_at": "2026-05-23T14:00Z",
    "sources": ["DONKI:2026-05-23T05:12:00-IPS-001", "kyoto-dst", "swpc-kp"],
    "notes": "Arrival inside the stated 80% window. Signed error: predicted - observed = -3.2 h (ran early)."
  },
  "provenance": {
    "catalog": "DONKI",
    "donki_activity_id": "2026-05-20T11:12:00-CME-002",
    "first_seen_at": "2026-05-20T11:50Z",
    "as_of": "2026-05-24T06:00Z"
  }
}
